{
  "artefakt_id": "A12",
  "projekt_id": "MA-20261003-001",
  "version": "0.1.0",
  "datum": "2026-10-03",
  "autor": "[Verantwortliche Person eintragen.]",
  "status": "Entwurf",
  "eingaben": [],
  "quellen": [],
  "offene_punkte": [
    "Beispielvorlage vollständig bearbeiten; fehlende Nachweise sind keine Freigabe."
  ],
  "gesperrt": false,
  "sperrgrund": "",
  "beispiel": true,
  "inhalt": {
    "datenquelle": "Noch kein tatsächlicher Analytics-Export vorhanden.",
    "zeitraum": {
      "beginn": null,
      "ende": null,
      "zeitzone": "UTC"
    },
    "kennzahlen": {
      "impressionen": {
        "wert": null,
        "begruendung": "Kein tatsächlicher Analytics-Export vorhanden."
      },
      "klickrate_prozent": {
        "wert": null,
        "begruendung": "Kein tatsächlicher Analytics-Export vorhanden."
      },
      "aufrufe": {
        "wert": null,
        "begruendung": "Kein tatsächlicher Analytics-Export vorhanden."
      },
      "durchschnittliche_wiedergabedauer_sekunden": {
        "wert": null,
        "begruendung": "Kein tatsächlicher Analytics-Export vorhanden."
      },
      "zuschauerbindung_prozent": {
        "wert": null,
        "begruendung": "Kein tatsächlicher Analytics-Export vorhanden."
      },
      "likes": {
        "wert": null,
        "begruendung": "Kein tatsächlicher Analytics-Export vorhanden."
      },
      "neue_abonnenten": {
        "wert": null,
        "begruendung": "Kein tatsächlicher Analytics-Export vorhanden."
      }
    },
    "beobachtungen": [],
    "hypothesen": [],
    "naechster_test": {
      "hypothese": "[Eine aus tatsächlichen Daten abgeleitete Hypothese formulieren.]",
      "veraenderte_variable": "[Genau eine Variable benennen.]",
      "durchfuehrung": "[Vergleich und Zeitraum für einen einzelnen Test beschreiben.]",
      "erfolgskriterium": "[Messbare Kennzahl und Schwelle vorab festlegen.]"
    }
  }
}
